{
  "artifact": "FHP-SYNTH-002 synthetic governed review packet",
  "case_id": "FHP-SYNTH-002",
  "as_of": "2026-07-17",
  "timezone": "America/Denver",
  "status": "READY_FOR_USER_REVIEW",
  "source_set": [
    "S1",
    "S2",
    "S3",
    "S4",
    "S5",
    "S6",
    "S7"
  ],
  "reviews_completed": [
    "Authority and source-set review",
    "Role and boundary review",
    "Current-facts and evidence review",
    "Capacity and recovery review",
    "Substantive alignment review",
    "Controlled revision and deterministic validation"
  ],
  "changes_made": [
    "Detected and corrected 10 deliberate candidate-output defects.",
    "Created source-attributed capacity context, pathway lanes, bridge records, findings, and bounded revision."
  ],
  "boundaries_preserved": [
    "Synthetic information only.",
    "No medical, work-capacity, occupational-therapy, eligibility, benefits, service, equipment, funding, or employment decision.",
    "No third-party approval, endorsement, acceptance-test pass, or operational approval."
  ],
  "known_gaps": [
    "Synthetic testing does not establish real-world reliability.",
    "External authorities have made no decisions.",
    "No marketplace installation or operational use has been authorized."
  ],
  "next_authorized_step": "Human review and governed scoring of this synthetic packet before any further test or use.",
  "still_unauthorized": [
    "Real-client use",
    "External distribution",
    "Marketplace or public release",
    "Real-world acceptance-test claim",
    "Operational use"
  ]
}
